d93a87c9-c921-463c-9877-f607270e35fa,10/02/2022 01:00,"Dear sir or ma'am, 
I'm writing you today about the difficulties I've been having with the Walmart pharmacy.  EVERY time I have to get a prescription filed there is an issue.  Either my insurance has not been applied correctly by your pharmacy and a$1.30 prescription costs$450. Or you've sent me a text saying I have 4 scripts ready and there's only 2. Any time I bring a new script and want it filled before I leave the store I ask for an estimate of time.  It is never the length that I'm quoted.  One time I expressed that I NEEDED it for that night.  They had an hour.  They knew I was waiting in the chairs for my prescription and they closed the pharmacy 15 minutes early and did not complete my order.  
I do not have many options for where I can shop.  You need to do better.  Be better.""",I don't have prescriptions there so there's no expectation of service in that department.  It's far away from where I live so my trips there are few and far between.,I love that when I want cake because I just have a Random craving ican go to the deli and purchase a piece of cake. I do not have to commit to a whole cake.  I can get a simple white cake with buttercream slice for a few bucks!,Female,45-54,Texas,Target
fc232051-90fd-4812-86d8-5e8a12322dec,10/02/2022 01:00,Price tags are often missing,,I love the value and the variety,Male,55-64,Texas,Walmart
0e1241e1-53bf-4505-9800-44f60100d3d6,10/02/2022 01:00,There aren't enough people for checking out. I'm disabled and have a compromised immune system. Waiting in line isn't safe for me or my family and self checkout is extremely different for me.,,Convenience of product and shopping,Female,45-54,Texas,Walmart
15fee3a0-9721-4679-b838-2df820983593,10/02/2022 01:00,I would like to address the that your store does not have enough employees and cashiers,,I love shopping there because that is where me and my family have been shopping there for years,Male,55-64,Texas,Walmart
5389cf13-5371-476f-a22f-f7f2ab5a9892,10/02/2022 01:00,that the store isnt clean and sometimes the associate are not friendly. And you always have only a few lanes open when your store has a lot of people waiting to check out.,its workers and store is amazing and well organized,they have everything i need in one spot,Female,25-34,Texas,Target
53a329d5-86ea-4fe4-82d9-f71352a3879f,10/02/2022 01:00,"would complain about shipping fees, out of stock items""",,good value fast shipping,Female,45-54,Texas,Walmart
ac01ce62-f39a-48ba-94a9-8d4eee6473b1,10/02/2022 01:00,SEE MY PREVIOUS ANSWER,THE STORES ARE CLEAN AND UPDATED AND THEY HAVE REAL LIVE CASHIERS,NOTHING SINCE THEY MADE EVERYTHING SELF HELP BUT DID NOT REDUCE PRICES. I AM NOT A CASHIER FOR WALMART!!!!!!!!!!!!!!!!!!!!!!!!!!!!!!!!!!!!,Male,45-54,Texas,Target
c2977827-47cc-4f88-ab0e-8767c109b217,10/02/2022 01:00,More checkers available during peak shopping hours,,every product you may need at a low price,Male,55-64,Texas,Walmart
5b863d22-3d3f-49bb-b38d-bf0572187a29,10/02/2022 01:00,The only thing I would complain about is the long lines,,I love Walmart because they are a one stop shop where I can find every thing I want in one place at a good pice,Male,45-54,Texas,Walmart
b8f3432f-bb8e-4e69-8ee8-d0f236dd5bc3,10/02/2022 01:00,I don't really know anything i would complain about unless I'm in store and come across something,,Everything,Male,18-24,Texas,Walmart
eeac57dc-7aeb-4d4a-b035-d6d10ae66639,10/02/2022 01:00,The lack of customer support,,I love how big Walmart is with all the available,Male,18-24,Texas,Walmart
59487cbe-ffc6-4745-8612-4addf59e1886,10/02/2022 01:00,"If I were to complain to Walmart headquarters, it would have to be about the fitting rooms and fabric cutting sections. They never seem to have an employee on duty there and even when you call for someone to show up, they never do. Last experience I had with the fabric cutting section, I was waiting for an employee to show up after I had pressed the help button. I heard them call over the intercom for someone to be sent and nobody showed up for about 10 minutes. I pressed the button again and while I was doing so, another customer showed up for the same thing. I was talking to the other customer about how long it was talking and they told me that the last time they were there, they waited for 30 minutes for someone to show up. However, nobody ever showed so they ended up cutting the fabric themselves and whenever they took it to the front they just put a price tag on it. I didn't think that was okay and I was in a rush and wasn't going to wait for 30 minutes to not get somebody to show up. So, since I know somebody who works there I called them and asked them if they could get someone down there. Within the next 5 minutes they had 2 people go down there and help me and other customers that needed fabric cut. When I told another person that I know who works there, they told me that usually the managers will ignore the calls for that section and customers tend to bring their fabric up there cut and no tags.""",,"What I love most about Walmart would have to be that I can do most of my shopping there and don't have to go anywhere else for the things I'm looking for. It helps that it is in a convenient location and I get discounts on the things I buy. They have some of the lowest prices when it comes to grocery shopping. They also have many options when it comes to other things such as, apparel, houseware, toys, seasonal, outdoors, and electronics.",Female,25-34,Texas,Walmart
da5b3d34-e2b3-47cd-95da-ecfabbb66791,10/02/2022 01:00,I would complain about how and employee was treated or how they treated someone. If I saw and employee being treated cruelly by another employee and the acting supervisor does nothing to correct the behavior I would write a complaint letter to the head of that Walmart. If and employee was treating a customer poorly for something the customer couldn't help or control the head of Walmart would hear about it.,,"I love the way I can get clothes, toys, diapers, wipes, cleaning supplies, animal shampoo, animal food, beds, bed frames, photos printed, cakes ordered, hygiene products, tobaccos, alcohol, shoes, and grocery shop at in one trip and all at the place.",Female,18-24,Texas,Walmart
deddc0fa-4f9f-444b-b61a-faccf8403b26,10/02/2022 01:00,"I love Walmart in general, but the 'rollback' prices are not always as low as other stores.  Lately, the inventory has been limited, but I write that off, considering the delivery issues in the U.S. right now.  I am very happy the shipping is now free because it is unpleasant to go into the store.  I do not like checking out myself, and when I do ask an employee a question, he/she is often dismissive or even rude.  It does not appear the employees are happy to be there.""",,"Easy online shopping, free delivery, and competitive prices.",Female,45-54,Texas,Walmart
95b0f245-8a8c-4c9c-a70e-6e4746157dd7,10/02/2022 01:00,well i was in walmart and the cashier was rude i told how to do her and she got pissed she do se not understand that i pay her to work here if not for me she would nt have her job,,i save money,Male,35-44,Texas,Walmart
489b761c-386b-4f9b-a009-4a1bdeb6baf2,10/02/2022 01:00,I would bring it to their attention that I am not a fan of their self check out. It should be my job to ring up my own groceries. That's why I go shopping so someone can do that for me who is getting paid to do it. It's frustrating having to ring up my purchases after a long day,,I like how they are conveniently located to me. They are very budget friendly and are a one stop shop store I can get my groceries and find an outfit for date night  all in the same place,Female,35-44,Texas,Walmart
679fc05f-950c-4ecc-a139-1dcc19239661,10/02/2022 01:00,"i dont like how the staff sometimes doesnt be no type of help , as if im suppose to know where everything is... even when i order something online it could be stock and it'll take my money out my account but then it sells out i dont get that...... but when i call yall act like yall cant do nothing thats why im done ordering stuff online""",target is amazing thats my favorite go to store like everything is always on point always never no type of issues at all,because walmart is too much,Female,18-24,Texas,Target
b127b9f3-0f98-466c-af6e-c727588b6312,10/02/2022 01:00,coupon issues should be fixed and employees should be more friendly,,everything in one place,Female,65-74,Texas,Walmart
cc18d3e2-2320-4dd4-8936-f42b95dca2d9,10/02/2022 01:00,wouldnt write one,,I like it becasue it is convienent,Female,55-64,Texas,Walmart