4a2ccec1-a19e-47a3-9174-edb010353a89,10/02/2022 01:00,Customer service in store.  Only feels like employees r restocking shelf's and don't say hi or welcome or have a nice day.,,Selection and close to home,Male,55-64,Texas,Walmart
79f05eb7-b0eb-4665-90be-88d4bb7a5dfa,10/02/2022 01:00,How they treat customers,Quality of products,Everyday life prices,Male,35-44,Texas,Target
a8128698-5394-486e-8c21-4569da935f7f,10/02/2022 01:00,There are not enough registers open especially during holidays. You wait in line too long.,,The selection they have and proces,Female,45-54,Texas,Walmart
a9bf8be7-fbd2-40b2-9b31-2ad04032e2c3,10/02/2022 01:00,"I would complain about the quality of some of the products, especially in the fresh produce and meat section. I would live to see more fresh meat selection so that i can do a complete shop at Walmart.""",Their selection of products are a higher quality,Everyday great value,Female,45-54,Texas,Target
afc55b0e-e1af-4880-99e8-1c155bc38339,10/02/2022 01:00,Cleaning and safe for shopping experience,,Price and selection,Female,55-64,Texas,Walmart
be9a213b-4007-47b1-9955-56c87924370b,10/02/2022 01:00,Walmart needs to clean the restrooms more often not just once a day of twice it's dirty and disgusting,The popcorn an Starbucks that they have,The deals they got on jewelry,Female,18-24,Texas,Target
c1ff1dc6-a2eb-4c77-8f86-7c30a52c0785,10/02/2022 01:00,"The checkout lines are always full. It takes forever to leave there. There is never an accurate price on most items. I need to scan the UPC in the app to find out what something costs. Items aren't arranged on the shelves neatly.  Sometimes it's difficult to find what I need but, it's usually there. The employees aren't willing to help find what I need. I can tell that asking annoys them.""",,The location is closed to home and has the items I use everyday at affordable prices.,Female,55-64,Texas,Walmart
c8468d60-58ca-4660-8668-bf2cac047b78,10/02/2022 01:00,Many Employees do not speak English very well or at all,Cleaner and better customer care personality,Selection,Male,65-74,Texas,Target
d0e47ce0-4084-4d9b-a982-396ef0360c3b,10/02/2022 01:00,Open up more registers (staffed) so the lines are not too long.  I do not do self checkout.,,I like being able to get everything I need in one place.,Male,65-74,Texas,Walmart
1f11476b-5be0-43d1-bb6f-d90bb66fc4e6,10/02/2022 01:00,I would not write a complmm‚àö¬±,,They have great product s and low prices with great service o,Female,45-54,Texas,Walmart
2ea6d669-405b-4195-bb88-9c94e7eee5bf,10/02/2022 01:00,"I am disappointed with Walmart for the difficulty in finding the category for which I am shopping.  Sometimes it is difficult to find a store associate who can help.  And, of course, you are out of stock too often recently.""",,"The low prices every day, great sale prices, large selection of products in most categories.",Male,,Texas,Walmart
41830b72-2c97-45be-bc1e-8d0f0979b3eb,10/02/2022 01:00,i have nothing really to complain about with wallmart.,,the prices mainly to be honest,Male,25-34,Texas,Walmart
482e3b81-ae45-41fb-bea8-bfa3ed80c630,10/02/2022 01:00,Checking out can be especially difficult with the little amount of staff present,Different variety of products I love,Availability of products,Female,25-34,Texas,Target
568fcbe0-7c72-40cd-8e0f-b64b24658b72,10/02/2022 01:00,Why are your employees so rude and untrained?,More variety and a cleaner environment,The layout of the store makes it easy to navigate even when entering a new location.,Female,18-24,Texas,Target
5c380c31-f90b-417a-9fd7-2d98ce6c8448,10/02/2022 01:00,The prices are the most definitely a big part of why people love to shop at Walmart. The diffent clothing types are Soo aweosme as well :).,,It has Low Prices and Many varietys of Options to choose from .,Female,25-34,Texas,Walmart
7f1aa5f1-f856-4a80-888a-b271fb178013,10/02/2022 01:00,"The complaint I really have about Wal-Mart would have to be the lack of open checkouts. I rarely see more than two open checkout lanes with a cashier. They do have seversl self checkout lanes, but even those are always crowded, and not everyone likes to go through self checkout, especially when you have a large quantity of items to checkout.""",,"Wal-Mart has just about everything you need. They have groceries, clothing items, hygiene items, medical, entertainment items, toys, automotive, etc. Wal-Mart also has great prices, and it's convenient.",Female,25-34,Texas,Walmart
83c9a207-88e6-4d9a-8b10-f1f5b161774c,10/02/2022 01:00,"Customer service sucks 
I'd say Walmart needs to have more of a variety of electronics in the store","Advertise, sell better product, and there store is all just cleaner",I'm able to find majority of the stuff I need quickly,Male,18-24,Texas,Target
a9cdb16b-4c9b-4926-8cc1-ac9795205826,10/02/2022 01:00,I will complain the Walmart gets low on stock quickly. Walmart doesn't have a good produce section. And a lot of people shop at Walmart so a lot of things are sold quickly,Target will have more things in stock than Walmart. Store presentation of target is better and the workers are nicer,What I love most about Walmart is there a variety of products,Female,25-34,Texas,Target
ac213f37-f9cf-4286-b854-9b80ac80ea24,10/02/2022 01:00,The hours. or maybe there's not enough deals,,The prices,Female,18-24,Texas,Walmart
cbbea14e-97c6-4cbc-965b-8c5f42f16b6a,10/02/2022 01:00,Unrelated substitutions,,Online shopping,Male,45-54,Texas,Walmart
cc7d4e91-fd08-48e1-8b27-916162d3a556,10/02/2022 01:00,Hi Julie just wanted you know that my friend is going on a trip to Mexico and she is a nice girl lol I just wanted you know I was just like a queen lol I think,,The prices are very much good and easy to access the products due to the organization,Female,25-34,Texas,Walmart
e0a339fe-99b3-496d-8011-99c5e8b0fd46,10/02/2022 01:00,My problem is that. Walmart is under staffed. When this happens the customer service isn't as good as it should be.,,It's Wide selection of items. And lower prices,Male,45-54,Texas,Walmart
f8beccbd-d5b6-4af1-a926-cd58fca99cc9,10/02/2022 01:00,I would complain about my walmart pick up orders being wrong pretty often.,,I love walmart pick up. I love their everyday low prices. I also like that it's a one stop shop. You can get almost anything you need there.,Female,25-34,Texas,Walmart
0b4cc421-b9b9-431e-b741-f1e7d1776fec,10/02/2022 01:00,Well in my neighborhood store now  Walmart has substantially downsized the staff. Cashiers are mostly replaced by self check outs and the store now is a real mess. Dirty washrooms and unkempt products,,Variety of products under one roof and reasonable prices,Female,25-34,Texas,Walmart
44ee4886-25d7-472b-8dfb-5853334937ca,10/02/2022 01:00,The main complaint I have especially with regard to the groceries is it the produce it's not always fresh and you have to give me a refund. I think that quality control needs improvement but otherwise things are working much better at your your stores are very good to respond when I have an issue and also it's nice sometimes you just call and give them a complement,,Walmart does a fantastic job of delivering in our area. I do not drive and getting my groceries delivered saves me a huge amount of money,Female,65-74,Texas,Walmart
53f317c5-3575-4583-8f39-e1f5948b14d1,10/02/2022 01:00,"I'm upset about Walmart taking out the cashiers, the customer service that they do, the company now oriented toward putting money into upper management pockets, since the Sam Walton passed there isn't any value or concern for the employees as before, there are more terminations happening to employees that have been around longer, plus there is no longer an atmosphere of family and friends in any of the Walmart stores.""",I actually have NO opinion about which is better. I have no first hand experience with Target. I do with Walmart. Especially when Sam Walton was alive. He took better care of his employees.  The Walton Family no longer runs Walmart.,"I loke the most is the convenience, lower prices, variety.",Male,65-74,Texas,Target
5ee8a378-30d2-4b07-a6d3-503ea26652e4,10/02/2022 01:00,It's kinda ghetto,more variety,Cheap,Female,25-34,Texas,Target
9a5aa5ac-afcd-4d9c-a30f-11dd73ada52a,10/02/2022 01:00,How people act dumb in the isles and being dumb about it,,"How you could always find what you need , like one time I wanted to make some pottery and I went to Walmart looking for some home based clay and I found the crayola bucket of clay and came home started right away , now I have some cute ring plates and vases for my cute flowers",Female,18-24,Texas,Walmart
9c44f2c1-f39c-4f0e-b15c-e963e3ca029b,10/02/2022 01:00,Nothing,,"What I love about Walmart is you can go there and find almost everything you need , the customers there work really fast && their prices are reasonable",Female,18-24,Texas,Walmart
0448bea1-14dd-48a9-9784-6b2df512f7dd,10/02/2022 01:00,The customer service is not always on point and they can be rude and dismissive and customer service matters because it makes people want to come back.,Target is high end and the customer service is always great.,I love that they have a wide selection of products that cater to everyone's needs and wants.,Female,25-34,Texas,Target
0d41c9e2-5ef9-422e-baa7-469d28b78377,10/02/2022 01:00,I would write a letter explaining how I have had a few friends who have worked there. They often complain how their hours are strange.,,They have really great prices,Male,25-34,Texas,Walmart
12aca9a9-cd60-4a11-8858-33c00d5b8310,10/02/2022 01:00,Hello i am one of your loyal customers i have a small compalaint one of your associates was screaming at a child in the women's bathroom i didn't get her name.would train your employees about how to trat people thank you,,You can buy everything in one store,Female,55-64,Texas,Walmart
224d1f97-c50d-4df7-ac45-f831f958f527,10/02/2022 01:00,"Dear Sir, I'm writing to tell you we need to work harder on customer service being consistent""",,All of the options they have available,Female,45-54,Texas,Walmart
320c09be-cb56-4736-86df-a996d61c9e50,10/02/2022 01:00,"I like the low prices, and the variety, but there meat, are to high""",,Variety,Female,55-64,Texas,Walmart
3399ec28-a9b8-49d8-ae75-7b9dacd418e0,10/02/2022 01:00,"Hello, the only complaint I have about Walmart is no matter what Walmart I attend. The makeup Shelves always need to be restocked. The lashes in particular. More mail options and skin care needs to always be refilled as well.""",,"I love the variety of products the sell from makeup, do clothes to car parts, tools and paints. Plants. And during Christmas time they have the most gorgeous trees! You can find anything at Walmart , medicine. Toys. Groceries. The list just goes on and on",Female,18-24,Texas,Walmart
4baa6f77-4801-4f43-8ca2-9a1713352f46,10/02/2022 01:00,"Low quality, poor service""",More fashionable.,"Low prices, convenience",Male,45-54,Texas,Target
5ee882e3-6563-4187-bf2c-e57225294d54,10/02/2022 01:00,There are not enough cashier lanes open during peak hours of shoppers causing the wait in line to reach checkout over 5 minutes on a good day.,Target always has multiple lanes open and I never have more than a couple of minutes to wait to checkout.  The ease of getting in and out makes it better.,"Walmart always has a sale, good prices, and variety of choices of items to choose from.",Female,45-54,Texas,Target
656b1fdc-6a79-4108-b601-054538577438,10/02/2022 01:00,I would complain about the prices for shoes at the store because slot of people who cannot afford for shoes go there because they used to be affordable and now they are $20 or more for a pair and they're not shoes that would last a long time especially for little kids that like to run around and don't know how to take care of things. But other than that there's not much to talk about it I do know some of their prices are expensive but I still go there for fresher better foods.,,"I love the diversity of items they have, and how organized and neat everything is. During the seasons they have decorations according to holidays and items for home decorating, foods organic, and healthy, and clothes and it's so diverse and my go to close by home store.",Female,18-24,Texas,Walmart
8846eb66-4cbb-4c2f-955a-da24c9179143,10/02/2022 01:00,A dirty store or unhygienic practices,Target has better presentation and better items to choose from but your do end up spending a little more. I just prefer to go to Walmart over target because I feel like they are just cleaner and have a better presentation,That I can find every little thing that I need at an affordable price,Female,25-34,Texas,Target
88d31110-81e6-49a9-bba4-92e0187ca857,10/02/2022 01:00,You treat your company employees like s*** you treat the customers like s*** f*** you Walmart,They don't treat their customers and employees as s***** as Walmart does,I don't I hate it but it took over the town,Male,45-54,Texas,Target
8f6f6b98-e901-4722-812e-2b3eb36fe7df,10/02/2022 01:00,This store I go to never has anything in stock especially cat food but also no pumpkin pies plus sick of.your self checkouts,,I do not love walmart actually hate them don't ever have anything in stock and always damaged cat food cans sick of the self checkouts,Male,45-54,Texas,Walmart
acb219f6-f9c0-4856-a714-1c0e778c2fad,10/02/2022 01:00,"Why isn't Walmart followup Ppe protocol's , told to be silent when testing positive for covid""",Better quality products,Can not say at positive  things do to Walmart tells anyone that gets Covid to keep their mouths closed  there is no employee protection in stores,Male,65-74,Texas,Target
d2f57fba-c3b2-49a4-9d3d-04efa70f5ffa,10/02/2022 01:00,Parking and the check out process,,Selection of items,Male,65-74,Texas,Walmart
e46ee8bb-0f48-4cbe-b589-9914e059ffdc,10/02/2022 01:00,You guys need to correct customer service bin your facility. A lot of your employees have attitudes and act like they don't want to help.,,They have everything I need in one store. I like that it is very convenient.,Female,25-34,Texas,Walmart
1b8ba520-dc15-4ee5-aa6f-ea76100392b4,10/02/2022 01:00,Please remove the stacks of inventory from the center aisle-it makes it too crowded.  Get more books and upgrade your party selection-it's kind of cheap looking.,Target is brighter and less ∫junkyπ than Walmart-they have cute displays for clothes and home goods.   I wish there was one closer to me and I would never go to Walmart again,Walmart is the only store in town to get the ∫thingsπ you need.   I do not buy clothes or gifts there but get daily needs taken care of there,Female,45-54,Texas,Target
1ea91091-c2f7-4e1b-a49b-372b429912b4,10/02/2022 01:00,There are not halal food there so I think it could be really good to get halal food,,Price,Female,25-34,Texas,Walmart
1f4a3337-aa4a-424a-90b9-faea6886570d,10/02/2022 01:00,Their employees don't care about customer service or their jobs. If I have an issue with someone or something I don't even complain about it anymore because I know nothing will be done and nobody will care,Target keeps their store cleaner and hires people that actually care about their jobs,It's close to my house,Male,25-34,Texas,Target
2c7a4d91-c25a-4e72-b003-f7b4306bb0c1,10/02/2022 01:00,"Lack of product,lack of promos,""",,"Product availability,pricing",Male,45-54,Texas,Walmart
61e80d52-a022-41f3-b7cd-2bcada2f4b5a,10/02/2022 01:00,No complaints,,Cheap prices,Female,25-34,Texas,Walmart
9b14bd29-e96d-4fef-b755-4f22b2c20b0e,10/02/2022 01:00,The losing items in the mail is the hardest u said u sent a item then it got lost,It always has great employees and merchandise,Lots of merchandise and always has what ineed,Female,55-64,Texas,Target
d821e898-1a57-4d7c-82b0-a2cf0f54ac6f,10/02/2022 01:00,The only thing I would give some attention to is customer service. At times it's hard to get a concrete answer sometes when there's an issue.,,There are many options to choose from and the shipping is quick,Female,45-54,Texas,Walmart
dec5facf-30c4-47dd-b322-ebdeca833bab,10/02/2022 01:00,Checkout lanes without checkers.  20 lanes and only 3 open,,Most of what I need in one location,Female,55-64,Texas,Walmart
f073c9ee-43f3-46f7-89ba-c1e099676f45,10/02/2022 01:00,"You are a multi billion dollar company. Please pay your employees a livable wage.  Stop promoting high wages and health insurance, only to make sure said employee never works the number of hours to qualify for those things.  I love self checkout, but you need to open your registers!  I'm tired of only 1 or 2 lanes being open and having to stand in long lines, when I Need to deal with a cashier for my transaction.   If you insist on making us check ourselves out, a discount should be given, or rewards earned, for doing so.  I like to get paid when I work.  
Also, since you are no longer open 24 hours, perhaps you could instruct your associates NOT to block off every single aisle with stock, an hour before closing.   It is very frustrating to try to shop and have to walk 10 aisles down, to finally be able to get to the other side of the aisle and turn around and walk the same 10 aisles to get what I need.  Or to Not be able to get what I need because there are several pallets blocking access.  
You have been around for generations, you Know better.  Please Do better.""","Target is just a nicer store.  It's brighter and cleaner.  I never have to try to navigate around pallets and pallets of stock on the floor while I'm shopping.  
They are a little higher, but sometimes it's worth it to avoid that aggravation.   
Their girls clothing department is on point.  My granddaughter loves shopping there.  Walmarts selection is very gimmicky.   
Target has self checkout, but they're are always plenty of registers open as well.  Also, they have a quick checkout service where an associate scans your purchases in line and then you swipe and go.  It's awesome.","They have the lowest prices on most items.   Since they have groceries, I can get most of my shopping done in one stop.  Also, I am a plus size woman and they have really stepped up their game in the plus size clothing department.  Outside of a specialty store, this is pretty much the only place I can go in store to find and try on clothing.",Female,45-54,Texas,Target
1b856c7b-70c9-4d6d-ba6a-a75d651ebdcb,10/02/2022 01:00,"The shelves could be stocked more, bathrooms could be cleaned more often, more self checkout lanes since they are taking away cashiers and when there are cashiers lines are backed up because there are only a couple of them.""",,The closest store to my house and has everything I need.,Female,25-34,Texas,Walmart
58f69ef3-7953-4b88-9f87-ab10ac0f61e2,10/02/2022 01:00,I'm sorry I don't know what to complain about.,,Everything is sold at Walmart that you could need .,Female,55-64,Texas,Walmart
9392c72e-84af-45f7-8d5b-16b3095d6219,10/02/2022 01:00,Self service checkouts and rude employees,It's cleaner and the employees are friendlier,They have low prices,Male,55-64,Texas,Target
9d42cc0d-ec41-4ee3-9f58-20fbb69030eb,10/02/2022 01:00,I would complain about the lack of help from associates in the store. When you are shopping and have an issue it's almost impossible to find help.,Target is more organized and the associates seem more helpful,Low price,Female,45-54,Texas,Target
c48d3a05-13f7-4777-ad0c-392a154559d3,10/02/2022 01:00,Nothing,,Wide selection,Male,55-64,Texas,Walmart
dd3fe5dc-7f45-4de0-aeb3-0047cd4a54d0,10/02/2022 01:00,Walmart is always out of stock of items that I need and when I try to order them online theyre not available,,"It is a one stop shop, I used to go to another grocery store that was mainly for foods, however, once you are at the store you start thinking of what you would want to do on your days off and how to achieve certain tasks around your home. That is what I love most about going to Walmart, anything I can possibly think of is there. I can shop for my groceries, for tools, clothes, shoes all at one place",Female,18-24,Texas,Walmart
ef02185f-0f58-496a-b4de-c3f35537a23a,10/02/2022 01:00,"I would complain about having to check out myself.  If they are going to make us to this, this we need to receive discounts on our products.  Otherwise hire more checkers.""",Target doesn't make you check yourself out.,"Low prices they always have and the variety of foods, clothing, electronics, etc.  It is a good place to save money on groceries.",Female,65-74,Texas,Target
f0e69671-a46a-4874-a416-209f01dc8744,10/02/2022 01:00,Variety,It has starbucks,Prices,Female,18-24,Texas,Target
29495ccf-ba1e-4703-8c81-272db51d17e0,10/02/2022 01:00,"I don't normally file complaints, however I would mainly mention that they need to treat their employees better and give them better pay and benefits.""",,"I love the ability to buy everything I need in one place, from produce and shelf stable groceries, to cleaning products, to home and beauty. I also like that the prices are always affordable and fit my budget.",Female,35-44,Texas,Walmart
5df54575-5e5e-4810-891b-27603839e69f,10/02/2022 01:00,Walmart has WAY TOO MANY self help checkouts. I feel that more human cashiers would help Walmart's image and also help the community.,Target has more real cashiers. :)  Also Target has a better quality store brand product.,"I like Walmart because it is close to my home. Also, they have the products I need/want at a reasonable price.",Female,,Texas,Target
73a54f02-1635-4727-817d-f3468fde2d9c,10/02/2022 01:00,"Eveytime I shop at wal-mart there are never enough cashiers and the lines are super long, its very frustrating.""",,Wide variety of what you are looking for. One stop shop. Reasonable prices,Female,35-44,Texas,Walmart
984c8f4f-756f-4b90-9bca-be6647e9a2e4,10/02/2022 01:00,During this time of pandemic  Shortages Some things have to be rationed. Walmart will place signs limiting qualities to individual customers but yet when they reach the register nothing is done they are allowed to go right on through with their purchase regardless of how many items they have. Take toilet paper or paper towels.  You're sign will say limit 4 per customer and you will see people walking out the front door with 4 baskets full and nobody confronts them this is a community and the last thing we need or want are horders.  In addition one of the things you should train your staff Is to be more honest if they don't know where an item is located in the store just admit they don't know they don't know versus sending someone with a cane completely across the store To look for an item that was just 2 rows over from where they were standing. For the most part Walmart is convenient most of its employees are friendly but there's still work to be done. Opening a few more registers during the day would help as where the lines get quite extensive before new cashiers are brought into play.,,The lower  Prices and proximity to my house.. They carry a variety of brands I am familiar with and prefer to purchase.  I enjoy the fact they have a good hot deli and cold deli where I can purchase fresh sliced lunch meats cheeses and hot items as well,Male,55-64,Texas,Walmart
d0fb022c-0793-426c-81fe-475d9edb4e4c,10/02/2022 01:00,"Self checkout is a a pain, not enough personnel to check out""",Offers higher end merchandise and has plenty of personnel,Convenient,Male,55-64,Texas,Target
d52438dc-b4e4-4213-9cc1-667c2223ba3e,10/02/2022 01:00,"The website for ordering is cumbersome.  I get items I want to pickup being shipped.  This happens because when I select pickup, items avaible for shipping are included.  Plus navigation on the app is not simple (childproof).  Gosh simplify it.  Amazon is EZ, ordering a meal on line is EZ, but ordering chip from the Walmart app for pickup requires coding experience.""",,"Curbside delivery (pickup), quick pickup, fair pricing, decent quality.",Male,65-74,Texas,Walmart
431d65bd-d5d3-4b49-ba92-2d098be3eb7a,10/02/2022 01:00,There never seem to be enough registers open and the cashiers on staff are by and large of below average speed.,"Cleaner, better organized. But I will say in Walmart's defense, they are more often closer to swamped than Target am swamped puts cleanliness and organization on the back burner",Full fledged retail outlet offering a lot of situations by which 1 stop shopping is enabled,Male,65-74,Texas,Target
640512d5-f2b8-444f-9aba-31bb46e18e11,10/02/2022 01:00,Walmart does not employ enough cashiers to handle customers on checkout.,Walmart is so anti labor which I do not like. They have fought the union for years.,"I love the convenience of Walmart, it's an one stop shop.",Female,65-74,Texas,Target
8b88f51e-21c1-4dfb-8bf7-f563769c9c69,10/02/2022 01:00,The food missing items and how bad delivery service was,,Delivery service low prices,Male,45-54,Texas,Walmart
c3f113e1-39ab-4d9e-a9a2-c87aca636758,10/02/2022 01:00,It's good,,It's a good place,Male,25-34,Texas,Walmart
c862cf22-0b39-4b7f-ae96-16319433880c,10/02/2022 01:00,Some of their policy are woke.,,wide selection and low price,Male,55-64,Texas,Walmart
d7df14c2-33c1-4471-80e1-d2bc04752181,10/02/2022 01:00,"I would complain about the Lactose Free milk spoiling long before the date.  I did complain about this by phone, and was told it is only supposed to last 7 days from opening, which I think is untrue.""",,Everyday low prices,Female,65-74,Texas,Walmart
